nama produk,harga,toko,asal,rating,terjual
Seblak Instan Ceu Nthien Khas Bandung Rasana Ngeunah Pisan,15000,Central Seblak Nusantara,Tangerang Selatan,4.9,1000
seblak instan jeletot jajanan hits bandung 1 porsi,4180,tokomakanankalimantan,Jakarta Barat,4.8,1000
Termurah Kerupuk Mentah-Kerupuk Seblak-Kerupuk Puli,6000,Djuragan Kerupuk,Surabaya,5.0,50
KERUPUK SEBLAK MENTAH 1KG WARNA WARNI - Mawar Warna,23500,BociKakang,Jakarta Selatan,5.0,100
TERMURAH KERUPUK KRUPUK KERITING MAWAR PUTIH MENTAH SEBLAK RAFAEL,5850,Kyta Bae,Kab. Sumedang,0.0,30
KERUPUK MENTAH SERBA 5000 BAHAN SEBLAK,6000,GK_Snack,Kab. Bandung,5.0,500
seblak instant sajodo snak,19000,hikmah berkah jaya,Jakarta Barat,4.8,750
Kerupuk Mawar Bahan Seblak Babangi 250 Gram,7000,Alanza Frozen Food,Tangerang Selatan,5.0,17
Seblak Instan Pedas Home Made,3500,the Dhecip,Tangerang Selatan,4.8,1000
SEBLAK JELETET MURNI (AJAHH),26500,Seblak Jeletet Murni,Jakarta Pusat,4.9,1000
Seblak Basranger Extra Pedas 200gr,17300,Rak Sebelah,Jakarta Pusat,4.9,250
SEBLAK JELETET MURNI (SEXXY),40000,Seblak Jeletet Murni,Jakarta Pusat,4.9,250
SEBLAK JELETET MURNI (UNYUU),26500,Seblak Jeletet Murni,Jakarta Pusat,4.8,250
SEBLAK JELETET MURNI ( BOHAYY),34000,Seblak Jeletet Murni,Jakarta Pusat,4.8,750
Seblak Cocol Seblak Coet Seblak Viral Seblak Bumbu Basah Seblak rafael,5000,FAG COLLECTION,Surabaya,0.0,0
"[OYI] Seblak Instant ""mBak'Well"" Rasa Mantap Bikin Nagih",15000,Welly Mart,Tangerang Selatan,0.0,2
Kerupuk seblak putih,18000,Snackzone KK,Jakarta Selatan,5.0,20
KERUPUK MENTAH BULAT PUTIH KERUPUK IKAN KERUPUK SEBLAK 1 KG - 250 GRAM,9000,Rempah Bu Risma,Kab. Bekasi,5.0,20
Paket Seblak Komplit Instan Pedas Gurih Cobek Kerupuk Mawar Viral,15000,LarisManis shopp,Kab. Bandung,0.0,0
SEBLAK VIRAL - SEBLAK INSTANT - SEBLAK RAFAEL - SEBLAK MAMANG RAFAEL,8880,FARADHIFY STORE,Bekasi,4.8,100
kerupuk seblak kencur pedas gurih,5000,RIKI STORE 97,Kab. Bogor,4.6,40
"baso aci boci instan maci eco ayam, keju, seblak",8999,snackbox88,Bekasi,5.0,100
KERUPUK KRUPUK SEBLAK SEBRING PEDAS TERLARIS PER 250 GRAM,22500,Golden Cakery,Jakarta Pusat,4.8,100
Seblak Instan Komplit Pedas Gurih Nikmat,5999,Baso Aci Ayang,Kab. Garut,4.9,2000
Seblak Kering Kurupuk Extra Pedas 1Kg Super Renyah&Gurih Asli Bandung ,5000,FIRMAN TEGAR ADI GUNA,Kab. Bandung,4.7,6
Paket Seblak Tjap Harian,10500,bawang putih tjap harian,Bandung,4.9,250
Siomay Cuanki Kering Isi 25pcs Toping Seblak dan Baso Aci Garut,7599,gaiagarut,Kab. Garut,4.9,100
siomay mini GURILEM EKONOMIS 50gram Toping Baso Aci Cuanki Seblak,1710,gaiagarut,Kab. Garut,4.5,6
seblak instant komplit bumbu cikruh bandung aufaro snack,6400,AUFARO SNACK,Kab. Bandung Barat,4.9,250
Kerupuk Seblak Kencur Pedas Gurih Kering Renyah Enak 250 Gr,11400,Retno Snack,Kab. Sidoarjo,0.0,0
Seblak makaroni pedas daun jeruk 500g,21600,SHAFIRA SNACK45,Kab. Bandung,5.0,8
Seblak Kering Cimol,11000,My snack910,Jakarta Selatan,5.0,12
Cuanki lidah murah kiloan isi 150 toping seblak baso aci,32500,CuankiCulametan,Kab. Garut,5.0,100
PROMO MURAH PAKET 10 BUNGKUS SEBLAK KOMPLIT BESAR PEDAS MANTUL ENAK,60000,Warung Kekinian 16,Jakarta Utara,0.0,0
KERUPUK SEBLAK SEBRING PEDAS,9800,Golden Cakery,Jakarta Pusat,4.9,250
Seblak Instant Carla With Batagor dan Siomay Jajanan khas Bandung,115000,Seblak carla,Tangerang,5.0,750
JSR SNACK PAKET BUNDLING HEMAT SEBLAK BASO ACI BASRENG RABOKKI,40000,DEVAN MUKENAH DEWASA,Jakarta Selatan,5.0,70
[READY MEDAN] Seblak Bandung Instan Super Pedas Termurah Lidah Cuanki,6900,CemilanPuas,Medan,4.8,500
seblak instan KSN frozen,10400,Pelangi Girls Naget 2,Depok,5.0,100
Mommy Seblak Basah Instant 100gr,10000,emmoshop,Kab. Bogor,4.9,2000
SEBLAK INSTANT TERMURAH,3999,Pusat Cuankie & Cemilan Frozen,Jakarta Timur,4.8,10000
cuanki tahu panjang stik isi 50 toping seblak baso aci,13000,CuankiCulametan,Kab. Garut,5.0,70
SamiRaos Baso Aci Geprek Tulang Rangu Seblak Baso Urat Yamin Noodle - Mie Seblak,18950,a grow exia (store),Kab. Bantul,5.0,17
Seblak Instan Sehati,13000,Official Kartika Sari,Bandung,5.0,500
Soun Seblak Geprek SAMI RAOS Khas Garut - Soun Seblak,19500,Foodstocks,Jakarta Selatan,4.7,28
Seblak Noni Noni pedas daun jeruk 1kg,40900,SHAFIRA SNACK45,Kab. Bandung,0.0,0
"makaroni kriuk 500g pedas extra daun jeruk,cemilan nikmat,seblak,makan",23000,anugrah seblak,Kab. Bandung,4.8,250
Kerupuk Bawang 250gr / Kerupuk Mentah / Kerupuk Seblak - Sahabatdapur,7500,Sahabatdapur1,Tangerang,5.0,8
SIOMAY MINI KERING 250 GRAM BASO ACI/BOCI/SEBLAK/CUANKI/CUANKIE,9999,ArfaOnlineShop,Tangerang,4.9,80
Cuanki Lidah Kerupuk Cuanky Topping Baso Aci Seblak isi 150 Pcs,33000,Kerabat Official Store,Kab. Tasikmalaya,4.8,100
Kerupuk Seblak bumbu kacang,15000,Allsnackbandung,Bandung,5.0,100
Batagor Kering Bulat 50buah,21000,Distributor Topping Baso Aci,Bandung,4.9,4000
Kerupuk Seblak Pedas / Kerupuk Seblak Merah,18000,Snackzone PP,Jakarta Pusat,3.5,16
Kerupuk Seblak BANTET Pedas /Seblak Pelangi  - 1/4 kg,15300,Golden Cakery,Jakarta Pusat,4.9,50
Batagor Aisha Frozen - Pangsit Tahu,26000,Siomay Aisha Frozen,Depok,4.9,3000
PAKET HEMAT (2 Seblak original - Seblak Karuhun - Cireng Bumbu Rujak),53250,kylafood,Bandung,4.9,750
Kerupuk Bawang 250 / Kerupuk Warna-Warni / Kerupuk Seblak,5000,blibuah official,Bekasi,4.9,250
"keripik beling/kaca 1/2 kg. bumbu seblak daun jeruk enak, gurih, pedas",25999,aghniya,Tangerang Selatan,4.9,250
seblak kerupuk bantet kering 75 gram,5000,RIKI STORE 97,Kab. Bogor,4.7,90
aneka kerupuk mix untuk bahan seblak 500 gr,14999,aghniya,Tangerang Selatan,5.0,100
Seblak Putri 80 gr,12500,King Fresh Mart,Jakarta Barat,5.0,10
kerupuk seblak pedas 1/2 kg / kerupuk seblak ½ - Pedas,20900,Adila_Putri_Snack,Kab.Ciamis,4.8,90
Paket k.y.l (3 Seblak Original 2 Batagor kuah) Kylafood,86210,kylafood,Bandung,4.9,3000
SiDaun Sambal Seblak - 40 Gram,21000,Ruang Kudapan Nusantara,Bandung,0.0,0
Seblak Soto ORI 250gr,15000,Mokosnacksby,Surabaya,4.9,50
Seblak Instant Basranger Extra Pedas Daun Jeruk (200gr),17300,Gerai Snack Official Shop,Kab. Tangerang,4.8,100
SEBLAK INSTAN special bumbu kencur rasa lezat,5999,aghniya,Tangerang Selatan,4.8,2000
Seblak Koko Cup,25000,Disiniajabookshop,Tangerang Selatan,5.0,15
Kerupuk Seblak Kencur / Seblak Jablay Viral @100-500gr,9000,Toko Camilan Anyar,Surabaya,4.9,50
KERUPUK PEDAS JABLAY PELANGI 1kg / Seblak Kering Kerupuk Bantat Seblak,62098,AHR Jaya Snack,Jakarta Timur,5.0,6
Seblak Mommy,13500,Gerai Snack Official Shop,Kab. Tangerang,4.6,2000
Paket Batagor-Toping Pilus k.y.l Kylafood,28490,kylafood,Bandung,4.9,1000
Paket Isi 4 Batagor Instan | Makaroni Basah | Seblak Basah,64906,Lakoca Official Shop,Cimahi,4.9,30
CEMILAN KERUPUK SEBLAK - PEDAS - 250gr | ANEKA SNACK LOKAL,14700,KAMI FOODS,Kab. Tasikmalaya,0.0,0
Krupuk seblak viral PEDAS SEDANG 100 gr,3500,Yuhuu snack,Kab. Karawang,0.0,0
PROMO !!!! Seblak Instan Beli 20 free 1 Murah Enak,4550,ivy's-kitchen,Kab. Tangerang,4.8,500
"siomay mini kering 250 gr enak renyah untuk basoaci,seblak,cemilan dll",9999,aghniya,Tangerang Selatan,4.9,90
COMBO HALU! 2PC BAKSO ACI INSTANT + 2PC SEBLAK - EMAK INDAH FOOD,89200,Pempek Emak Indah,Jakarta Barat,4.8,30
cimol seblak pedas 200gr,10000,Akun_Kuliner,Tangerang Selatan,5.0,13
Kerupuk Seblak Mentah 1kg - Krupuk Oren Matahari Pagi MP - Kemplang,16000,Cuanki_Bandung,Kab. Bandung,4.9,100
"Kerupuk Seblak Pedas 100 Gram, Kerupuk Seblak Daun Jeruk Gurih Renyah",13688,Bawang Goreng Nion Nion,Tangerang Selatan,4.5,20
"kerupuk seblak pedas dan gurih daun jeruk - Original, 1 kg",50000,BOSofficial,Kab. Garut,0.0,0
SEBLAK KERING 100gr DUA VARIAN RASA - Pedas DJ,9000,jajanangarut19,Jakarta Selatan,4.5,100
seblak kerupuk bantet pedas-kerupuk bantet wana-seblak pedas-seblak,15000,Juhalim Store,Kab. Garut,5.0,15
seblak instan varian mie tanpa tulang,10000,Ladjangfood,Bandung,0.0,0
50pcs LIDAH Cuanki Batagor bahan Pelengkap Boci seblak dan cuanki,15119,lahawelah,Kab. Garut,4.9,250
"500 pcs Cuanki Lidah Kemasan Besar Topping Baso aci, seblak, cuanki",106000,Endo Shop ID,Kab. Garut,4.9,250
Seblak Baso Aci Instan,13500,hilmandza,Kab. Tangerang,5.0,6
Kerupuk Seblak Pedas Mimi,18000,Snack Zone Official,Jakarta Selatan,4.9,70
BUBUK CABAI/CABE BASO ACI/BOCI/SEBLAK/CUANKI ECERAN,699,ArfaOnlineShop,Tangerang,5.0,250
Seblak Original k.y.l Kylafood,16605,kylafood,Bandung,4.9,10000
seblak sosis/pansos ekonomis,6000,Nasyadia shopestore,Cimahi,0.0,0
Kylafood Seblak Mie Baso Sapi Play,18550,kylafood,Bandung,4.9,250
Batagor Bandung,40000,Kopi Aroma Nusantara,Jakarta Selatan,0.0,0
Seblak Kwetiaw k.y.l Kylafood,17415,kylafood,Bandung,4.9,4000
BOBOKO Kerupuk Seblak Kering,13999,Kenal Jaya Bandung,Bandung,5.0,100
basranger seblak extra pedas instan praktis murah halal cemilan,20580,TOSERDA,Bandung,4.8,19
krupuk mentah seblak,4500,masulah,Surabaya,0.0,0
kerupuk seblak kering pedas daun jeruk 250 gram,15000,Toko Yazid Cita Rasa,Bandung,5.0,4
kerupuk seblak pedas daun jeruk 1 kg,37500,hokinaCemilan,Cimahi,5.0,100
SEBLAK KICIMPRING MANG MUSS,8250,Seblak Mang Muss,Tasikmalaya,4.8,750
cuanki tahu gepeng isi 100 pcs toping seblak bsso aci,38999,CUANKI CULAMETAN,Kab. Garut,4.9,80
Cuanki tahu atau batagor kering kiloan murah isi 150 seblak baso aci,32500,CuankiCulametan,Kab. Garut,4.8,80
"Paket Cemilan Cup Instan Praktis (Batagor, Cuanki, Seblak Basah)",59000,The Little Snacks,Tangerang Selatan,4.9,250
Seblak Bapper Bikin Nagih Parah Extra Mie Kuning 120gr,18300,Gerai Snack Official Shop,Kab. Tangerang,4.9,50
KERUPUK SEBLAK 250gr / KRUPUK SEBLAK DAUN JERUK / SEBLAK PEDAS,12500,Dapur Sehat21,Kab. Bandung,4.9,100
Kerupuk Orange / Kerupuk Seblak 250gr / Kerupuk Mentah - BawangBagus,7500,BawangBagus,Tangerang,0.0,5
"Seblak kuah instan , Seblak khas garut b",5000,iwan resistans leather 2,Kab. Garut,4.9,500
Paket seblak sosis untuk 3 porsi,29000,Tukangsayurmbakyu,Tangerang Selatan,5.0,8
Kerupuk jeblay kiloan 1 kg pedas Kerupuk seblak,35000,RIKI STORE 97,Kab. Bogor,0.0,1
